{
    "$schema": "http://json-schema.org/draft-07/schema#",
    "description": "Used for validation of data/json/raw/complex.json JSON file.",
    "type": "object",
    "properties": {
        "$schema": {
            "type": "string"
        },
        "name": {
            "type": "string"
        },
        "description": {
            "type": "string"
        },
        "version": {
            "type": "string",
            "pattern": "^[0-9]+\\.[0-9]+\\.[0-9]+$"
        },
        "date": {
            "type": "string"
        },
        "license": {
            "type": "string"
        },
        "authors": {
            "type": "array",
            "items": {
                "type": "string"
            }
        },
        "php-version": {
            "type": "string",
            "pattern": "^[0-9]+\\.[0-9]+\\.[0-9]+$"
        },
        "symfony-version": {
            "type": "string",
            "pattern": "^[0-9]+\\.[0-9]+\\.[0-9]+$"
        }
    },
    "additionalProperties": false,
    "required": [
        "name",
        "description",
        "version",
        "date",
        "license",
        "authors",
        "php-version",
        "symfony-version"
    ]
}